{
  "format": 9.0,
  "rotation": {
    "screens": [
      {
        "kind": "game",
        "priority": 2,
        "required_status": "live",
        "teams": ["Nationals", "Red Sox"]
      },
      {
        "kind": "game",
        "priority": 1
      }
    ]
  },
  "standings": {
    "divisions": ["NL East", "NL Wild Card"]
  },
  "demo_date": "2019-08-17"
}
